"ID"	"item_name"	"tags"	"comment_value"	"how many people have commented"	"distance"	"字段1"	"introduction"
1	"bills お台"	"western food,desert，salad,coffee"	3.59	102.00	0.00	"313894.jpg"	"世界一の朝食、と言われたお店の
お台訾违鹰毳氦扦埂＃Collected by reviewers of the 4travel.jp）
都内にもふと荬つけば何店nかありますね。"
2	"エッグスンシングスお台"	"western food,desert"	3.41	36.00	0.00	"pic-odaiba.jpg"	"ハワイアンガ`リックライスについては、スパイシ`なものが食べたくて注文したしたのですが、ココナッツL味の甘いごでした。好みが分かれるところですね。（Collected by reviewers of the 4travel.jp）"
3	"スタ`バックスコ`ヒ`アクアシティお台"	"coffee,desert"	3.37	25.00	0.00	"5f9e2_0004408703_1.JPG"	"Famous coffee shop in the world chain"
4	"お台訾郡きミュ`ジアム"	"japanese snacks"	3.37	36.00	0.00	"7054.jpg"	"お台訾违钎氓ス|京ビ`チにある「たこき店」がKぶフ`ドコ`トです。たこきの本?大阪で人荬韦店、有名なお店が集まっているだけあってフ`ドコ`ト内はかなり混jしていました。たこきの食べ比べなどをすることもできるので食事やおやつなどで立ち寄ってみると良いです。（Collected by reviewers of the 4travel.jp）"
5	"クアアイナ　アクアシティお台"	"western food, salad"	3.35	26.00	0.00	"photo1jpg.jpg"	"大好きなハンバ`ガ`屋さんのひとつクアアイナ。ハワイからきています。狙いはハンバ`ガ`よりもパストラミのサンドイッチです。が、今回はサラダとポテトにしてみました。さすがにコブサラダだけではまだ足りない。ポテトとセットでイイ感じ。
（Collected by reviewers of the 4travel.jp）"
